<?xml version="1.0" encoding="UTF-8"?>
<libro isbn="1234567890" idioma="es" formato="tapa_blanda" xmlns:xsi="http://www.w3.org/2001/XMLSchema-instance" xsi:noNamespaceSchemaLocation="biblioteca.xsd">
    <autores>
        <autor id="a1" rol="autor">
            <nombre></nombre>
            <apellidos></apellidos>
            <nacionalidad></nacionalidad>
        </autor>
        <autor id="a2" rol="autor">
            <nombre></nombre>
            <apellidos></apellidos>
            <nacionalidad></nacionalidad>
        </autor>
    </autores>
    <editorial></editorial>
    <sinopsis></sinopsis>
    <categoria nombre="novela"></categoria>
</libro>